{
  "schemaVersion": "1.0",
  "generatedAt": "2026-08-25T07:40:00Z",
  "requirements": [
    {
      "id": "REQ-CLIENT-001",
      "title": "Select Client and Access Client-Specific Clinical Functionality",
      "module": "CLIENT",
      "approved": true,
      "approvedBy": "Masud Rana",
      "approvedOn": "2026-08-24",
      "clinicalSmeSignOff": true,
      "specPath": "aidlc-docs/requirements/REQ-CLIENT-001.md",
      "acceptanceCriteria": [
        {
          "id": "AC-001",
          "text": "The user can access the Client area. Observable outcome: the Client area is displayed.",
          "coverage": "COVERED",
          "coveredBy": ["TC-CLIENT-001"]
        },
        {
          "id": "AC-002",
          "text": "The user can select a client from the Client selector. Observable outcome: the selected client is displayed in the Client selector.",
          "coverage": "COVERED",
          "coveredBy": ["TC-CLIENT-002"]
        },
        {
          "id": "AC-003",
          "text": "The selected client provides the active context for Skills Programs. Observable outcome: Skills Programs displays information for the selected client.",
          "coverage": "NOT_COVERED",
          "coverageJustification": "Held at S3 pending GAP-010. Whether showing another client's data in a read-only view is a clinical-rules.md section 21 association failure or a lesser context error decides the assertion strength, and writing the test against the wrong strength would produce a test that passes while the defect ships. Deferred deliberately, not overlooked. See aidlc-docs/design/REQ-CLIENT-001/coverage-matrix.md."
        },
        {
          "id": "AC-004",
          "text": "The selected client provides the active context for Behavior Support. Observable outcome: Behavior Support displays information for the selected client.",
          "coverage": "NOT_COVERED",
          "coverageJustification": "Held at S3 pending GAP-010, on the same basis as AC-003."
        },
        {
          "id": "AC-005",
          "text": "The selected client provides the active context for Analyze Data. Observable outcome: Analyze Data displays information and controls for the selected client.",
          "coverage": "NOT_COVERED",
          "coverageJustification": "Held at S3 pending GAP-010, on the same basis as AC-003."
        }
      ],
      "clinicalRules": [
        {
          "ruleId": "CL-006",
          "statement": "Patient identity must be verified before acting on patient data. Applies to client selection because the ratified taxonomy holds Client and Patient to be the same entity.",
          "source": {
            "document": "aidlc-docs/rules/clinical-rules.md",
            "location": "section 8"
          }
        },
        {
          "ruleId": "CL-002",
          "statement": "Clinical data must remain associated with the correct patient/client.",
          "source": {
            "document": "aidlc-docs/rules/clinical-rules.md",
            "location": "section 21"
          }
        }
      ]
    }
  ],
  "testCases": [
    {
      "id": "TC-CLIENT-001",
      "requirementId": "REQ-CLIENT-001",
      "acceptanceCriterionIds": ["AC-001"],
      "objective": "A user who can access the application reaches the Client area and finds it displayed with a client selector offering at least one client.",
      "specPath": "aidlc-docs/testcases/REQ-CLIENT-001/TC-CLIENT-001.md",
      "priority": "P1",
      "testType": "POSITIVE",
      "automationStatus": "AUTOMATED",
      "duplicationDecision": "NEW",
      "bddScenarioId": "SC-001",
      "clinicalRuleIds": ["CL-006"]
    },
    {
      "id": "TC-CLIENT-002",
      "requirementId": "REQ-CLIENT-001",
      "acceptanceCriterionIds": ["AC-002"],
      "objective": "Selecting a client makes that client the active client, and demonstrably not another client offered by the same selector.",
      "specPath": "aidlc-docs/testcases/REQ-CLIENT-001/TC-CLIENT-002.md",
      "priority": "P1",
      "testType": "POSITIVE",
      "automationStatus": "AUTOMATED",
      "duplicationDecision": "NEW",
      "bddScenarioId": "SC-002",
      "clinicalRuleIds": ["CL-006", "CL-002"]
    }
  ],
  "bddScenarios": [
    {
      "id": "SC-001",
      "featureFile": "features/client/REQ-CLIENT-001.feature",
      "scenarioName": "A user reaches the Client area",
      "testCaseIds": ["TC-CLIENT-001"]
    },
    {
      "id": "SC-002",
      "featureFile": "features/client/REQ-CLIENT-001.feature",
      "scenarioName": "Selecting a client makes that client the active client",
      "testCaseIds": ["TC-CLIENT-002"]
    }
  ],
  "automation": [
    {
      "id": "AUT-CLIENT-001",
      "testCaseId": "TC-CLIENT-001",
      "filePath": "features/client/REQ-CLIENT-001.feature",
      "testTitle": "A user reaches the Client area",
      "tags": ["@REQ-CLIENT-001", "@TC-CLIENT-001", "@P1", "@positive", "@AC-001"],
      "staticValidationPassed": true,
      "qaReviewedBy": "Masud Rana",
      "codeReviewedBy": "Masud Rana"
    },
    {
      "id": "AUT-CLIENT-002",
      "testCaseId": "TC-CLIENT-002",
      "filePath": "features/client/REQ-CLIENT-001.feature",
      "testTitle": "Selecting a client makes that client the active client",
      "tags": ["@REQ-CLIENT-001", "@TC-CLIENT-002", "@P1", "@positive", "@AC-002"],
      "staticValidationPassed": true,
      "qaReviewedBy": "Masud Rana",
      "codeReviewedBy": "Masud Rana"
    }
  ],
  "executions": [
    {
      "id": "EXE-run-2026-08-24T1204Z-TC-CLIENT-001",
      "testCaseId": "TC-CLIENT-001",
      "requirementId": "REQ-CLIENT-001",
      "automationId": "AUT-CLIENT-001",
      "environment": "dev — https://clinical.dev.rethinkbhtech.com/, Chromium, Playwright 1.62.1, retries 0",
      "executedAt": "2026-08-24T12:04:00Z",
      "actorRole": "Dev user; account menu reads role \"Role 4.\" This is a placeholder, not a configured clinical role.",
      "testDataRef": "Runtime data read from the client selector. data-mode: substituted — the backend returned no clients and the application served example data.",
      "result": "PASSED",
      "runCount": 1,
      "evidence": {
        "traces": ["aidlc-docs/evidence/run-2026-08-24T1204Z/traces/TC-CLIENT-001.trace.zip"],
        "apiEvidence": ["aidlc-docs/evidence/run-2026-08-24T1204Z/results.json"],
        "phiReviewed": true
      }
    },
    {
      "id": "EXE-run-2026-08-24T1204Z-TC-CLIENT-002",
      "testCaseId": "TC-CLIENT-002",
      "requirementId": "REQ-CLIENT-001",
      "automationId": "AUT-CLIENT-002",
      "environment": "dev — https://clinical.dev.rethinkbhtech.com/, Chromium, Playwright 1.62.1, retries 0",
      "executedAt": "2026-08-24T12:04:00Z",
      "actorRole": "Dev user; account menu reads role \"Role 4.\" This is a placeholder, not a configured clinical role.",
      "testDataRef": "Two distinct clients read at runtime from the client selector. data-mode: substituted.",
      "result": "PASSED",
      "runCount": 1,
      "evidence": {
        "traces": ["aidlc-docs/evidence/run-2026-08-24T1204Z/traces/TC-CLIENT-002.trace.zip"],
        "apiEvidence": ["aidlc-docs/evidence/run-2026-08-24T1204Z/results.json"],
        "phiReviewed": true
      }
    }
  ],
  "blockers": [
    {
      "id": "GAP-010",
      "token": "NEEDS_SME_CONFIRMATION",
      "description": "Is showing another client's data in a read-only view a clinical-rules.md section 21 association failure, or a lesser context error? The answer decides whether AC-003 to AC-005 assert data integrity or context correctness, and therefore the assertion strength and defect severity.",
      "blocking": true,
      "affects": ["REQ-CLIENT-001/AC-003", "REQ-CLIENT-001/AC-004", "REQ-CLIENT-001/AC-005"],
      "owner": "Independent Clinical SME - not yet named. Routed out of QA on 2026-08-25: the sign-off precedent set for this requirement covered read-only scope, not the clinical severity of cross-client data exposure. The same unnamed role also owns GAP-007 on REQ-CLIENT-002.",
      "raisedOn": "2026-08-24"
    },
    {
      "id": "GAP-011",
      "token": "NEEDS_SME_CONFIRMATION",
      "description": "The clinical sign-off for REQ-CLIENT-001 was given by the same person who approved as QA lead. Permissible under clinical-rules.md section 5 and defensible under section 35 given a read-only workflow, but recorded rather than left implicit.",
      "blocking": false,
      "affects": ["REQ-CLIENT-001"],
      "owner": "Product",
      "raisedOn": "2026-08-24",
      "resolution": "Accepted on risk grounds for this requirement. Explicitly does not carry over to REQ-CLIENT-002, which writes clinical data; an independent SME was required there on 2026-08-25.",
      "resolvedBy": "Masud Rana",
      "resolvedOn": "2026-08-24"
    },
    {
      "id": "BLK-010",
      "token": "NEEDS_SME_CONFIRMATION",
      "description": "Which data mode the suite may run against. The application substitutes example data when the backend does not respond, so a green run can reflect fallback data rather than real behaviour — a false pass no retry policy detects, because nothing is intermittent.",
      "blocking": false,
      "affects": ["REQ-CLIENT-001/AC-001", "REQ-CLIENT-001/AC-002"],
      "owner": "Product and QA",
      "raisedOn": "2026-08-24",
      "resolution": "Any mode tolerated, but recorded as execution evidence. Both executions in this record ran under data-mode: substituted, captured as a Playwright annotation.",
      "resolvedBy": "Masud Rana",
      "resolvedOn": "2026-08-24"
    },
    {
      "id": "SRC-001",
      "token": "NOT_SPECIFIED",
      "description": "Expected results for this requirement derive from screenshots of the running application, which rank seventh of eight in the aidlc-e2e-rules.md section 3 source hierarchy. The approval did not characterise the requirement as a regression baseline. These tests detect change from current behaviour; they cannot detect a defect already present in it.",